{"$schema":"https://json-schema.org/draft/2020-12/schema","$id":"orchestrator-engine://schemas/metrics-observation","title":"Metrics observation","schema_version":1,"kind":"ORCHESTRATOR_METRICS_OBSERVATION","type":"object","required":["schema_version","kind","observation_id","source_id","observed_at","effective_at","known_at","record_type","scope","data"],"properties":{"schema_version":{"const":1},"kind":{"const":"ORCHESTRATOR_METRICS_OBSERVATION"},"observation_id":{"type":"string","minLength":1,"maxLength":256},"source_id":{"type":"string","format":"uuid"},"observed_at":{"type":"string","format":"date-time"},"effective_at":{"type":"string","format":"date-time"},"known_at":{"type":"string","format":"date-time"},"record_type":{"enum":["source_capability","execution_attempt","work_item","classification","acceptance","quota_sample","delivery","obligation","report_snapshot","scope_revision","scope_item"]},"scope":{"type":"object"},"data":{"type":"object"}},"additionalProperties":false}
