{"schema_version":1,"kind":"ORCHESTRATOR_METRICS_OBSERVATION","observation_id":"synthetic-observation-1","source_id":"11111111-1111-4111-8111-111111111111","observed_at":"2026-09-08T10:01:00Z","effective_at":"2026-09-08T10:00:00Z","known_at":"2026-09-08T10:01:00Z","record_type":"execution_attempt","scope":{"operation_id":"synthetic-1"},"data":{"execution_id":"synthetic-1","status":"completed"}}
